review_id,user_id,business_id,stars,date,text,useful,funny,cool
187GulImTm0-C-El84udDw,Lxoyzoa6-WHNCVXKWpVamg,J1NQNefrN04g3idH0EBLfQ,5,2017-06-20,"One of the best experiences I have ever had. I have done paintball, speedball, air soft, and all those sorts of sports. But this took it to the next level, making you get down and dirty. After this, all those paintball\/ air soft games seem like a walk in the park. Its more than just playing around and shooting each other, its a chance to experience and learn about how a real gunfight would go down, and how just because your opponent is out of ammo, does not mean he wont come in and try to tackle you to the ground. Not only was the actual experience itself great, but the owner, Nephi, and his helper Jesse were great. They were constantly giving us advice, tips, and tricks while also having fun with us and not just sitting back and observing. The knowledge they shared, definitely will stick in my mind. I will for sure be coming back in the near future, and I definitely recommend it to anyone looking for something much more tough and fully involved.",0,0,0
_YfgYF7ZuZn57l44rSEwDw,bdlFwefJOfC8xBiezIF4AQ,_-NY8_8Jv6rwCGG405Br5g,3,2016-07-17,"It seems that quite a few restaurant have tried to make a go at this location and the latest is the Times Buffet. They have a mix of sushi, Hibachi, and Chinese along with a mix of stuff you'd not expect like French Fries and pigs feet.

We checked it out to since my son likes sushi and his demands for sushi can get expensive. He was free thanks to a special they were running.  

If you go, ask to sit near the front of the restaurant. If you've ever been to a Ryan's buffet (a staple in college), the bars are in the middle of the store so you can sit behind or in front.  We sat in the back and it was HOT.  Even the hostess told tried to sit us in a better spot but it was still warmer than I had anticipated. 

It is what is it: an inexpensive $11.95 buffet. If you're expecting a culinary revelation, try the Jello.",0,0,0
uDcdLPjNp74ML-FW3CZVnQ,hl_iQkx2xTDRd7wACVLQXQ,SW6ZQk22G1_CV81_gfnvNQ,4,2013-09-15,"This is one of my fave chill restaurants in Toronto. I first discovered it at the underground food market and they have blown up since then. My fave tacos is the beef cheeks, it has a sweet and meaty delicious taste. Best drink is the who shot ya?? My only suggestion is that they switch up the menu... I've been so many times and now I've tried everything. It would be nice to offer different items for regulars now.
Enjoy!!",0,0,0
zrFoKEC2y8zSdz6AxhfIBA,6TrHhqsu8nlzOBew137AnQ,NvKNe9DnQavC9GstglcBJQ,5,2013-12-27,"This place had deliciousss food. I ordered the Pasta Carbonara and i had them add some steak. It originally included amazing bacon, peas, and alfredo sauce. I was hungry for some steak on top of it all. I let my friends try my dish. The 4 of them each got a forkful of the pasta, bacon, peas and sauce combo (i didn't share my steak)... they all raved about it and couldn't believe PEAS could be so delicious. Grand Lux pulls it off.

My friends had:

chicken and waffles... 4 stars (good but too sweet for her)

burger... 5 stars delicious

crispy caramel chicken 5 stars!!!

chicken parmesan... 5 stars

I had an overall really great experience with the food here and i can't wait to go again!

Tim our waiter was very attentive and helpful as well as knowledgable about Vegas tourist info. Thanks Tim!",2,1,2
pqdKGOhNJwyHIs8Uf1eo_w,l3ryB3Q6WZ3uHDHVe2HgoA,MGCNbzOP48LrWwUW75uWLA,5,2017-07-22,"This place is amazing. The service is unbelievable here and the spa is decorated very pretty. It is spotless clean and the staff is professional. I get all my facials here and don't trust anybody else with my skin. They offer a ton of services here from facials to massages manicures, pedicures, and waxing. They use all organic products for their facials as well. What I really like is they truly evaluate your skin and diagnose it. For example, if you are  having a breakout they ask you questions about your lifestyle to help diagnose the problem and for how to treat the facial you are about to get. This place would also be awesome for bridal parties. I've seen bridal parties having a spa day here and they make it special with mimosas and fresh fruit. I would definitely recommend giving them a try for your next to Spa services you will not be disappointed.",1,0,0
7bWfAD_c-OOXIWHssyYiKA,8IuxHBypodI4PalectVIjQ,80H8EnyShhq6_ZENH7aV3A,5,2013-11-08,"This place is fantastic. I've been to a few Thai places this is number two favorite behind a tiny joint in Silverton, Oregon. The curry, not runny, just a little thick like it should be! 4 of us for 4 different dishes and ranted and raved about all 4! Thumbs down to the wonton soup, but two thumbs up to everything else, including the prices. Good portions, you can request the level of heat of your spicy foods. What more could you want? We did have to wait longer than I would've liked for our food, but it was custom made to the heat and SO worth the wait. Five stars. Definitely try it. We are so glad we did. In fact my husband and I decided this is our new date spot every week until further notice. We want to try everything on the menu.

Don't forget to try the coconut ice cream made in house!",0,0,0
MxxKEX71fOb3YxKy6a6p4A,Fm4aiobGHSlEoTj6JP9RJw,1JjRQgxV3UFJlpFF6npjUw,5,2017-06-22,"I had ear problems for years that went ignored. After an ear wax extraction, I could swim without my ears clogging.",0,0,0
yOIEJeWm8k4kvhl0uvfIFw,0AMYqVq6AAbmibINey4fOQ,LWtKuyX8w5SFm-JviPr4qQ,1,2010-08-26,"Where to start? I should have probably read the reviews on yelp before going to the restaurant .. but I didn't ..  .. btw before i get started why is there filtered reviews? maybe i missed something ..;

anyways went here for lunch with a co-worker because its close to the office .. the decor is okay and we were quickly seated but thats as good as it got .. none of the staff make eye contact, everything is slow even tho the establishment wasn't busy, there was just no importance on quality .. 

we ordered one of the lunch specials, the pricing is good, but I learned a long time ago, you get what you pay for, so for $7 to $15 you can get a salad, appetizer, sushi, chicken\/beef, dessert, etc

the food was cold and really average, they forgot our sushi and when we pointed it out to the manager he said he would take it off our bill .. a whole $1.20?? for 6 sushi rolls .. like i said u get what u pay for ..

my co-worker, who is from hong kong blasted the manager, but he was no help...

so i will never go back .. but the experience got me back to using yelp! ;)",2,0,2
w6Ebpr2X6Phof5hGbA0o9w,dvZmVTocwx0RmUZKK7Ts0g,0nC6DvVibGPKwMp65WiU7A,5,2016-07-01,Amanda and the entire staff were extremely welcoming. I love my hair and will definitely be returning.,0,0,0
vUu7BHkiVUJkFpD4bV2fzw,nKYiVYbqoWTYjymBCMrxyA,h1Jq1YlqPyD1mGSW0sjRaQ,1,2015-01-31,"I have major problems with Centurylink home phone service.  True it doesn't rain very often in the Valley but each time it does I get a message on my phone ""NO LINE"". The first time I got this message their customer service implied that it may be my phone so I went out and bought new phones.   By the time the service person get to my home the ground has dried out and my phone has begun to work again and then I'm told they cannot find the problem unless my phone is not working when they arrive.  Well, they know what the problem is the lines are getting wet.  I'm ready to go back to COX!",3,0,0
FCPv-ASp4Ge1XHFZX30reg,ucC72baAawj8yx69X7xBHA,H7kB4p-1BsbvL522cqASOQ,5,2011-09-22,"I had seen this place featured numerous times, magazines, TV, radio ads, but since I lived over an hour away it wasnt on the top of my list to try. When my husband was headed to the Cave Creek area for a short errand I decided here was the opportunity to try it out, and we were glad we did! I got the pulled pork sandwich with cowboy beans and my husband got the ribs with the coleslaw and potato salad. All were delicious! The ribs were my favorite, they had great flavor, they were moist and they practically fell off the bone. The potato salad is creamy but not too creamy, and the beans were fantastic! I would definitely recommend this place. The next time we are in the area we will be making a stop.",0,0,0
MPcHiFSwJ5yyqbbkgdAwbA,vWQRmv8kVibtchTSBR1LWA,hmYnzs8-aHbltaOOGDgmbA,2,2016-03-17,"The place looked really fun when we were driving by so we stopped in on the St. Patrick's Day but the service was super slow and it seemed like the staff was irritated with us when we ask questions in fact at first they tried to deny my service animal the right to come in after showing Proctor proper documentation with attitude they allowed him.  

We just ordered burgers and fries and it took over 35 minutes to get our food which we thought was kind of long for 3 o'clock in the afternoon

The turkey burger was pretty small but I guess it was only 7.50 but it just was a pretty small portion .

Our server Tiffany was cute and great with the diet coke refills but just not to friendly.  Maybe mad working on ST PATTYS DAY 

Was kind of random but there was a french fry in our salad I thought it was cool but my friend was pretty upset

I would give 3 to 4 stars if the staff is nicer and they didn't harass me on my dog I can deal with having to wait for food all in all together my experience was 1 to 2 stars at best",1,0,0
t2caaYPRLk0ED_-TDk-3DQ,61KHh-BznR__JiiN5iMwHg,w8zw4-3Ns2M4CQxeW9Bszw,3,2008-01-28,"I wanted to go to one of the top 5 clubs in LV so we ended up at Jet. 

I wasn't super impressed. I guess I expected more. The line went down for what seemed like miles. Thank goodness our VIP host was fabulous. Of course it was easier since we were all girls. We hate waiting in line! :)

I mean it was crowded as heck and there were lots of hot people, but it was small and the music was just okay. The go go dancer girls in the lingerie were cute but some of them were yucky. One in particular stood out.

The guys in there were SLLLEEEEEAAAZZZZYYYYYYY. 

Jet itself is ok. I guess we stayed to satisfy my curiousity. Would I go back? Maybe after I check out every other ""hot"" club in LV.",4,4,3
m9FfUH-c608Xlbtvp_Y2Eg,4QCyrAmr254nHxrMOQovdw,2k01kgbLdNV9b19GrOqdNA,5,2017-06-13,"Best pizzas in Vegas
Owner, Louie, is so kind and friendly. from NYC and brought his  delicious pizza recipes to vegas. Fresh ingredients fresh pizzas every time i come in I get comp garlic knots. Good stuff",0,0,0
v4Hs0VsrNnYyzyLOO8LPLA,SI7ULsb4uCK0Ovv5K_Qrcg,oRgoOhwCex1X9j1iQ9ou3w,1,2016-01-02,We had our fair share of dim sum all around the GTA. This was one not a good dim sum experience at all for such a pricey place. The service was lacking and the food was lacking favour an freshness. Our beef ribs were raw inside so we send it back to the kitchen and it was still raw the second time. They forgot our siu Mai and BBQ ribs and charged us for it. We left the place disappointed and do not recommend it at all.,1,0,0
wPP8T6QPnd4bzZ_-xu19IQ,8z_EK_OYXGOR4cd5qiEBHw,RVt3dKDevhEs0gVMYeL6_w,2,2013-05-25,"The broth of the gumbo is the best I've ever tasted anywhere, but I'm afraid that's about the only good thing I can say about this restaurant. For staters, don't set your expectations too high. The restaurant is located in a small food court. You sit at community tables shared by the entire food court. Not a particularly good part of town. I wouldn't go there after dark. Your gumbo is served to you in a styrofoam cup. Tall and narrow. Hard to navigate. You eat with plastic utensils. The gumbo cup is filled with a lot of crab shell pieces which you need to crack open with the provided metal cracker utensil, but the pieces are too small to be opened. I tried to order a side of fried okra. They were out. Changed my side order to corn bread. Was told I've have to wait 30 min. for the bread to be prepared. Ordered red beans and rice instead. The beans were way overcooked.",0,0,0
MBXPAB42TOzIfVLjZSStqA,sSUrAfS4OO2ATzavPqCg_g,JAmQCmczUclNUfZjkNdjQA,3,2017-08-31,"We were looking forward to our first ride on the High Roller during our six-night stay in Vegas. I'm here to tell you that it's irrevocably anti-climatic. The sole, Achilles-heel issue with the High Roller is the actual setup itself: locked inside a tiny, ironically spacious ""eye bubble"" with a bunch of plastered, disgusting strangers. The obnoxious strangers really took away from the experience. I would imagine the High Roller is pretty rad if you have your own party of 12-15 to take up a single ""eye"". At any rate, most of the apex views are absolutely stellar.",0,0,1
pcwXwMDPWLbVpoBk8Qqmpw,vvQhikDPjAzHfSLVgnFkPQ,wJ3SVmc9AHLbOH-TViBJkQ,4,2013-08-10,"During the Festival, this fantastic beer garden pops up and takes over the University's George Square. I love the laid-back beer garden atmosphere here. They have good popup food and drink stalls as well as venues for various festival shows. The standard, not-too-original drinks are mainly on offer (Fosters is featured prominently) but there was also a margarita stand and fun outdoor seating. It's great here both during a sunny day or during a warm evening, but they have heating lamps if it gets chilly!",5,0,1
MZ364Vb5aTPS9P-NjBWiSQ,Z-F2H6H3_2G-YNN9DkOwTg,SIBaomIYVvsMU0GTuqX4vQ,1,2016-12-06,"LITERALLY the worst sushi I've ever eaten.
The host acted like she'd rather rub shit in her hair than speak to us. From there we were treated to flavorless, clumsy over priced drinks, stale rice, rolls that were unraveling before they hit the table, chewy nori (how does that even happen?), low quality,old (clearly merchandised), smelly cuts of fish and mochi balls that were so old, cheap or freezer burned that even the waitress said she wouldn't recommend eating them. All this capped off with a bill DOUBLE what we would pay for double the food at FAR SUPERIOR sushi restaurants.
You'd (100% serious) be better off getting grocery store sushi and eating it at a light rail station for improved quality, service, price and ambiance.",0,1,0
R2RSPFlE0miwHSn3N-NWVQ,zx6gq8IslnAwCyCUztXn1A,siXCBrVFOXicbM2R-33-8w,4,2010-10-07,"Delicious!!!

  I was able to stop in here between dogwalking appointments yesterday, and I'm very happy I did.

Great food, great staff and great location.

I am a die-hard burger fan, and LOVED the sweet and spicy burger.  

Try it!

The parking lot can be difficult.  There's a lot going on in that little strip mall area.",5,1,4
XMn_IXncySOjQ9AR0yXq0w,HVoDO9f_2njoxJu_nlK0SQ,iIwKW2cBAxjElE8eUzjwqA,5,2017-08-24,"One of the best burgers I have ever had. The meat was seasoned to perfection, tangy red pickled onions, spicy green chilis and crunchy potato chips. The sweet potato fries are crust and sweet with a fantastic mustard horseradish dipping sauce. I have always liked Bobby Flay - the only thing that would have made this meal better is a visit from him. :)",0,0,0
tGeJHvEfqBN_vsg64h9Z4A,H2iBcTT5nqDDb7ZifSZn8g,wYSWgZMiMJxfusnxeWKYXg,5,2017-06-17,Delicious breakfast. What I've been craving for since moving to Charlotte. Very authentic. Had the carne Asada with eggs and home made tortillas. My SO had the chilaquiles. Huge amount of food but neither one of us left a bite.,0,0,0
6T7Ub0nVzTqGeNC3IjKiww,q87gAr1nrLOu8fY5GA9ZUw,QXV3L_QFGj8r6nWX2kS2hA,4,2017-09-03,"First time trying this place. It was delicious, would definitely come again. Nachos were delicious (many options), breakfast burrito was simple yet tasty, and the wings were flavorful. Also, our server\/waitress, Gabby, was terrific! Very attentive, polite, thorough, efficient service. We were celebrating a birthday, and she helped make it great.",0,0,0
KJF2cQXNsa8i4lB4IC0AIQ,VO16w17eBZOXO-evJrLvBw,mRZCTkOgDc28VWYMvo3nVQ,5,2016-08-31,"Been here quite a few times for lunch and dinner and never had a bad experience. Food is good, menu has a wide variety of choices, there's outdoor seating, and the prices are reasonable especially considering the amount of food you get. 

I've ever only gotten a beer with dinner so I can't really speak for the bar scene or what it's like after 9pm. Would recommend for lunch or dinner though.",0,0,0
df7bC-AfDxA_Dby6KKRqCw,cm8FpL5fpWVq6xXF_t77dA,cKdox2gt3L1Dbb7MpOPdWg,4,2015-06-04,"The foie gras poutine is to die for!  It's a must order in my books.  Crispy duck fat fries with a large slab of foie gras.  The duck in a can was a bit overrated in my opinion. I'd skip the novelty of it and try the duck entree instead.  Great atmosphere, very lively.",0,0,0
zA__Ti0E3x_rTUN8B0a7ew,hbSZIHGu955t6W9ZUYeH3Q,vOMDU31gdylrzBhAKC9QbA,2,2017-11-02,"I came here from LA to try out this 5-star yelp reviewed sushi restaurant and I was extremely disappointed. My boss and I dined here and he was treating me out for my 26th birthday so we ordered the omakase plus extra sushi. 

I came in here around 9pm and first thing I noticed was that there were not that many fishes available for some reason and I believe this contributed to how small our sushi pieces were. I felt like the chef gave us only what he had remaining and had very few premium fish left. The quality is decent, (nothing that amazing) and the portions were extremely small. I believe the waitress was the chef's wife and she was extremely nice to us even telling the chef to give some service since it was my b-day and we came out from LA just to try this place.. Chef told her okay, but it never ended up happening. Just for my boss and I we spent close to $400 including drinks for very mediocre sushi and will definitely not return. Don't even know what to recommend because nothing really stood out.

Overall subpar sushi, decent service, low quantity, and very expensive. Not sure if it's because I just came at a bad time when the chef had no good premium fishes left, but my experience here was nothing but horrible. Not sure how this could be rated 5-stars, but I will not return to give it another shot. Omakase in LA was much better and cheaper than the one here.",0,2,0
_oJkTxZJnkpPWsX85USLTQ,9Vr2KcpCcCQleIGo2-YO6A,_GQtY4e4mwQlm-f3DwCIDw,1,2015-02-03,"I must have went at a bad time. I chose this place to get my nails done because of the good reviews. As soon as I got out of my car, about 3 ladies walked out and I asked if they were closed. They said no but still asked what I needed done, I guess in case it was something that only one of them could do. But I said just gel polish and they told me one of the guys inside could help me. The older guy I got took forever and did a horrible job. He cut my nails after I asked him not to and then he proceeded to round them out when I asked for square. He drilled them so thin they were tender and red. And then he applied the gel polish so sloppy, my nail beds burned every time I put them under the light. Worst experience ever. I would not recommend getting your nails done here by the older gentleman. Maybe the ladies do a better job.",1,0,0
YQVeihkn6yyL_fx3UhHjKw,dsqvK2lHdLvxIQSxGOf__A,p9UMu6H_C2kf3yi3gwyeRg,5,2017-08-13,Great burger special with onion rings. Chef cut it in half to share and gave us each a pickle! Thank you!! Watching the Cardinals and the D'Backs!!,1,0,0
_iKaFRP2A1pWa0p3kGxEbQ,paHQpwcvr2MIKGCEoK4YUw,UPIYuRaZvknINOd1w8kqRQ,4,2012-07-23,One of my favorite places to eat! I'd never turn down and invite to eat here. Their spicy powder really does it for me cause I'm a fan of spicy! The only downside is there's not many places to sit so you have to wait awhile to be seated sometimes. Also wish they would get rid of the $10 minimum card charge. Sometimes I just don't have cash and don't want to have to order extra stuff just to meet it. Other than that I will forever be coming here!,1,1,1
HdXvqCjJmmW9ckjh7--Guw,KC2S-aQsd8qeNhbYCW_xgA,G8qvbhfbCyMAeZzYrbmZxA,5,2015-02-28,"Love this place - it's cute, cozy and intimate. Nice bar too! Paella del Carmen was delicious.",0,0,0
LFSm62VZZWmRgxaoXMuzOg,RfY-0o1DZUz4XcTD8DDavw,DZwXQUa5KGUcJ0y4TO1pFQ,3,2017-04-07,"I hope to here back from management after reading my review, if not I'm not going and sending in customers. We love eating at mom and pop restaurants. When I went pick up my lunch that was ordered for 12 people, there was one person working at the counter and three of us waiting. This poor guy at the counter had 3 phone lines going customers at the counter and zero help. Whoever owns or manages this facility needs to get more help. The restaurant was completely empty other then us waiting for him to help other customers. You will obviously get more business if you had more help,  just my opinion. Thank you,",0,0,0
32t5IXgdUMREGci_O2Smgg,sasvOq9d2WaBrN5l5RukQw,MgbDWOfxzM9jNhWkpnt6bw,5,2017-02-16,This is an awesome dental practice. I live at least 45 minutes away but don't care. It's well worth it.,0,0,0
xpydQj_-fbTA8IewxxWtFA,cMEtAiW60I5wE_vLfTxoJQ,5A_sjC9ULLt4UkDNtr9dkw,5,2016-01-25,"Such a cool place to hang out on a Saturday afternoon with a coffee or beer and listen to some live, acoustic music!  I love that the patio is dog friendly too...bonus!",20,12,18
cfT2bIl4S6YtMDArUOEhmw,qwIv2g6m1hmR3LTu9disqw,BN6-gHm2ZMkZoGT8VZaiRw,3,2015-05-23,"Came here to buy almost all of our furniture. Overall we found everything we were looking for. The sales rep were helpful and weren't  pushy to make the sale, most of the time they left us alone so we can make our final decision. They have a good variety of furniture and you have to check out the clearance section. The only bad thing about this is the cashiers who treated us every time like we were bothering them and you can tell the sales associates don't like them either. Also the movers were rude and unpleasant to have them deliver our furniture for us.",0,0,0
KRw7nFC_bk0M05FhwI2f4g,w21sfuNsexdEzuzO8vrUIQ,SBnpT6JDbah-5l_52GM5sw,5,2013-11-03,"The space is absolutely lovely, with simple colors, heavy wooden beams, some light industrial touches, and cozy nooks too--there are farm tables and tables with lake views. The food was lovingly prepared and I had the salmon which was perfectly grilled and served with delectable mushrooms and smoky lentils. The mussels came in a cream sauce that we soaked our bread in--yum! Great cocktails and service, too. Don't hesitate--just go.",0,0,0
rhEISVKjcdedRCxljO0_Vw,iFbgPR9AMci9Sg2dDsNPGw,RtUvSWO_UZ8V3Wpj0n077w,5,2017-08-01,"Went there for drinks with friends after a long day of roadtriping from Montreal. We arrived there around 10:30pm on a Saturday evening and it was farily crowded, but we did not have to wait for a seat. The ambiance was amazing with the employees greeting you loudly, which can shy a few customers. 

Since we only went there for drink, I won't be able to comment on the food. We ordered a few sake bomb ""for good times"" as the menu said. It was indeed a good time as all the employees yelled (in a good way) in anticipation for the sake bomb. After us, a bunch of other tables also started to order a sake bombs and then started a sake bomb train. Will def come back again to try their food.",2,2,1
WCdXSm2TG1N_UX7FbrRiSg,fFSWvNgcd8ojLKshObT47g,dKdApYVFDSNYsNOso6NYlA,1,2015-07-20,Ugh. We literally ate raw beef yesterday and we were fine... But White Castle made us sick! Can't go anywhere because I have to be within a five feet radius of a toilet. Kind of ruined my last night in Vegas! Don't go here if you can help it.,0,0,0
j5cWUi3FRBmmhTwlXGlTug,52-f8IPmufOAOUCtE8P6Qg,iPxDmZVbssspPtUEBnUyQw,1,2016-09-02,"Pretty gross. Although they provide great customer service, a manager was in tonight and had the employees cleaning the vents over the food (yuck!) and mopping the counter top with a floor mop. It was very disgusting. We don't even want to eat out pizza.",2,0,1
frqENywSUgflC8UAmm7oTg,GyO0c0VgivnkSOvmhPKhwg,dYdUpWcYpSFKgzjSfED83g,5,2010-07-22,This is my favorite bar in Kent when I want to just spend some time with my friends. You can actually hear each other talk here and it is really laid back. I love to go there on a weeknight and bring in take-out and have a beer from the WONDERFUL beer selection. The bartenders are all really nice and not pretentious. Kent has really needed something like this for a while.,1,0,0
qIQRbsbPmu5Nd0ZjTRKc3Q,sukLuxQtlGluDNhFHG4fpg,JXTlt-mRrQoE2_gfijhp4g,4,2017-06-05,Came here for a quick dinner. My boyfriend enjoyed his dinner however I did not love mine. The service was average. I don't think I will return.,0,0,0
z_9bRM28woRmZKXx0D-XUg,4uB8ROmVptzpXteyPui1ZQ,iVTw0miizU79B4TcT3mJnA,1,2015-12-16,"This place has bad service from day one, that's why I stopped going there for a while now.  There're plenty of places with much better desserts, and most important of all, appreciate your business!",0,0,0
haRNuQn2BV88YX8VlQ99YA,YjZo1ogljY1C9x_w2Z-CCQ,IOEGLxXwCNiq4P-U359D7Q,4,2017-10-17,"Went to Those Guys Pies when i was in Las Vegas and tasted both the pizza and cheese steak sandwich since people claim its very good!!! I Have to say the Pizza was pretty good. Good quality ingredients and tasted Great! The Cheese Steak Sandwich was Good and had a good Taste but it Sure was Not Huge like it seemed to be on ""Diners, Drive-ins and Dives"" Overall it was Good!",0,0,0
