review_id,user_id,business_id,stars,date,text,useful,funny,cool
RdE9JUXXFcOhhx0wOanq_A,WCHArapR0ZhduJElR9axjA,tJGd-FJbO1Kl_e-NYTOh5Q,4,2012-04-13,I am a big fan of this place. I happened to come on the most randomest day and had one of their cheesecakes and a chocolate crossiant. The owner was really sweet and his crossaints were delicious. Dont hesitate to come grab a sweet bite if ever you pass by this exit of the sherbrooke metro station :),0,0,0
0Bos7IjMn65ekvWt5M2eZQ,OfdX0DGrAET9jqn_7gkXww,ajoqEHnCZTD8-8GqGLq9-Q,2,2010-11-21,"This place is a huge disappointment. Tiny casino with a small selection of machines. Here's a big hint: if your casino has a McDonalds inside you are not over a 3 star. I don't know why Palms has such a high rating on travel sites. 

Oh, I got screwed into staying in the older tower, which still had a tube tv. Even I don't have a tube TV. So by staying here I downgraded my lifestyle. Also, the bathroom is really crappy. Going along with other reviews, I agree the tub is so short it comes up to your calf. They get one star for having Aveda products, but that's all they get.  

Housekeeping came by at 9pm to ask if I wanted my room cleaned. No? Wtf is wrong with them? They're supposed to be cleaning when i'm NOT THERE. 

Also, I had to wait until 6pm to check in because they weren't done cleaning my room. The front desk said they'd call me when it was ready but they never did (I waited 2 hours). When I went back to the desk to ask, they claimed they did (LIARS). 

I called some toll free numbers from the room phone and lo and behold, because I dialed *9* to get out of the 702 area code, I had to pay $1 per call. On top of the daily $1 telephone access fee.

Yeah, if you're thinking of staying here because there is no resort fee, think again. This isn't what I consider a resort so no wonder there is no fee.",4,1,1
zZCV4t9kcaxKSEFQao4aQg,AZ0Mkf2i_FLiBLHsCPOw9w,DkYS3arLOhA8si5uUEmHOw,5,2010-12-29,"It is open 24 hours, the sandwiches are fresh and hot.  You have to try it if you're in vegas.  Sober or not, delicious!",0,0,0
vOMoit4IS1kU0FwlOxchXQ,EhdKnqsqZf07Awj2oWxjZQ,DfgZlNgKwBvCpA_0alumXw,3,2016-01-22,"First time staying here in over 15+ years!

They've remodeled quite a bit and are in the process of remodeling the rooms.

The rooms have an updated look... but with all the money they still have smallish TV's (40""?)  Service from everyone was great... front desk, maid, concierge, etc.

Only gripes are the little details in the room were overlooked... loose faucet handles, disgusting bath mat, moldy looking grout between bath tiles... these really kept me from giving it 4 or 5 stars.  I appreciate the remodel and the overall look, but the little things bring it down!

The restaurants in the hotel were pretty good. Buffet was not the best but a great price, BLT burger was great, CPK was pricy but delicious, overall can't complain.

There were plenty of tables to gamble at throughout the day... with mostly $10 blackjack and as low as $5 for some of the gimmicky games like 3 card poker or let it ride.  Cocktail waitresses were super friendly but a bit slow on the drink orders.

Stayed here for a conference, wouldn't be my first choice on the strip but it's not a bad one either.  Give it a shot!",4,0,0
VTSvbKzWO1pjhtGe4-7n4A,hVqW4SxHsb911kWixBLvWQ,a1dFBt3S60Iz12bfUjmwoQ,1,2016-01-05,"I wouldn't take my pup here for any reason.  We called to speak to them and set up a time to tour their facility.  They didn't answer during their business hours listed on their site.  We left a message and they never returned our call.  My parents were out visiting locations for nicer boutique kennels.  They came out during their business hours listed.  Assumingly one of the owners (the husband), was out taking down decorations from the holidays.  He wouldn't show them the facility.  He wasn't rude but asked they come back the next day between 9:30 and 10:30am.  They showed up well before 10:30.  The male owner walked inside their house and the female owner came out.  She was EXTREMELY RUDE to my 70+ year parents who wouldn't know how to be rude to a person.  She wouldn't let them in to show them the facility.  She said they could come back in 4-5 days if they want to see anything or just not come back at all. She accused them of missing an appointment when they never made an appointment and came specifically when they were told to by the husband who wouldn't let them in the day before.  There is obviously something going on with this place when 1. Possible customers are not let in to see the facility for any reason.  2. They do not return calls to possible customers. Why would I ever expect them to call me if something is wrong with my pet?!  3. They are so extremely rude to ANYONE!  We are not the only people this has happened to obviously looking at other reviews.  Learn how to treat people before you start a business.  Especially one that deals so closely with customers family members (Pets) that rely on them so heavily.",0,0,0
D_Mv8ZawlPjLYYzUM1C8vw,cKJ0r01eF7E-tYp2FQOyRA,gOOc6MDdhw7fV0Tf30mfAQ,5,2017-10-30,"I've had this place bookmarked for the longest time.  They serve fried chicken, waffles and grits... sinful, comfort food.  The reviews on yelp said the place is tiny, a bit slow (as they cook to order) and terribly busy on weekends.  For my visit, I came on a Tuesday at 11:15, right before a normal lunch rush. 

When I walked in, I was relieved to see there were a few empty tables.  Yelpers weren't kidding. This place had 9 or 10 tables, and no where to really stand if you were waiting for food or a table.  There were a few tables outside, and fortunately it wasn't hot that day.

The staff greeted us, and handed us a menu.  I narrowed my choice to the Kentucky: wings + 2 sides, which I chose grits and yams.  An order of grits came with 1 topping, so I chose bacon... truly not a healthy meal, is it?

Stephen chose the Louisiana Hot Link sausage, eggs, and grits with bacon AND cheese (0.75 more for an extra topping).  He chose cornbread while I chose a biscuit.

The food took about 20 minutes, and while we waited, we were served our drinks. Sweet tea for me, diet coke for Stephen.  She even stopped to give us refills.  Top notch service.

The meal was delicious, and not overly greasy.  It didn't look like a lot of food, but it took a while for me to finish it... and I was truly full all day. Even when we had a late dinner at 9:30, I wasn't really that hungry.  I'll be back for more, but will visit only if it's mid-week.  The boss lady said if you come on weekends, show up at 7:00 am or be prepared to wait!",9,3,5
2yzKm5fgd_OgBkupUGdm3Q,BifGN4bYTVNR4_5b8MmUfQ,b7XTyK_z8Nsl-uds_l6imQ,5,2017-10-08,"Great quality food, prices can't be beat, and Pizza is prepared fast and is absolutely delicious. Will be coming back in the future for sure.",0,0,0
J6mTzjGq2r_b8roN8dIPMQ,uRKJG5JTufIH1WhmJrqR6Q,lCbvbCkJOn2ABdHrcFqNzQ,5,2015-09-07,Amazing! The owner cooks and his wife serves. The best breakfast I've had in Montreal!! The setting couldn't be more perfect. Very glad we stumbled upon this magnificent restaurant.,0,0,0
LrFL9KT-iu28Y5SQ0NnedA,3cZEJcR2HTPQD_IVsRG2Lg,qalkZ4AQDWzYrFvQVrSPOg,5,2017-08-06,"With adult children at home for the summer, making memories is the goal.   This was our first experience with escape rooms and it lived up to all the hype!    With an hour of time we worked together through clues, secret passages, lasers and locks by using clues to find solutions to the puzzles.   Levi was thorough in his directions, shared the history of Escape Rooms and  stories about the groups that have beat the hardest room here.   We are definitely going to do this again!   Thanks Levi!",0,0,0
DSHrnMXNqQYjs1Vikcf39Q,Nbr4DYLPxURjxelLVTSt8A,-_TSaVr53qiEGqMkwyEMaQ,5,2016-11-26,"Better late than never but this place is Mediterranean heaven!

Ordered the steak plate & loved the Mediterranean rice & salad. Definitely add tzatziki & definitely get the pita chips & hummus. The steak was so tender & seasoned well. 

I also loved the customer service. Workers were very welcoming & explained how to order upon finding out it was our first time. 

My only dislike would be the baklava (which you get for free with a Yelp checkin). I just didn't enjoy the texture & taste but besides that, dinner was awesome! 

Will definitely come back!",1,1,1
BKltxBrsRsJ_rjtx0Ioesg,0v4sabX7a6r8blrGtzVKuw,y-Iw6dZflNix4BdwIyTNGA,4,2014-04-19,Been here twice so far and planning to visit again!  The food here is fantastic no complaints.  However the service friday night being extremely busy the service was dreadfully slow.  We went for dinner again during a week night and the service was much quicker. Root beer is really good.,0,0,0
BY2Iq5uNDfGTCPnKyg5sPw,W37KqgMymarQaqYGOWS70w,8xI4hJ3nS4avEoo_l62dkw,1,2015-04-03,"Update: Since inquiry minds want to know, here is the reason (which I found out after several emails to the completely apathetic Mayor) why I got the ticket (drumroll please) because I left the property to go somewhere else. So, If you are a mom strolling the mall with a baby but buy nothing, you are welcome. If you are a mall-walker just doing your daily exercises, but buy nothing, you are welcome too! But if you are trying to hit two birds with one stone and think you can park at the mall and do a few other errands while you're there, beware! Mississauga's hospitality knows no bounds! It made me feel so wanted, all warm and fuzzy inside, they really know how to treat their visitors. They had plenty of empty parking spots, I guess they just need some extra money for their renovations.

I invite everyone to visit Unionville or Mainstreet Markham where the parking is always free and plentiful! You will be treated as a paying guest should be treated, not like a criminal.",2,0,0
95RY0GYiWV76AvF5fB9oQA,63Zzq8kfYV7CLxoXLzOp7A,TaEASKZil0TT7CAzyqFUgw,2,2017-08-31,"This place needs A LOT of work!  For starters, we walked in past the patio so we saw that there were 4 or 5 tables open so we were happy we would get to sit outside.  When we walked in it took a long time to be acknowledged so I finally went up and asked if we could sit on the patio... the girl at the counter was scratching her head and said the patio was full..  so we went to the bar and I saw the 4 tables still open.. granted they were dirty still but we wanted a patio table.  So I went back to the hostess and told her there were 4 tables open and she said ""oh OK""..  wow really??  So that was our initial experience... the rest of the night didn't go much better... drinks took FOREVER to get to our table.. and the place was not busy at all!!  The server forgot to bring our salad... the food is way expensive, ribs EH... nothing special.. then it took a very long time for the server to bring our check.  Just wasn't a feel good enjoyable experience.  Won't be back... too many other good choices in Cleveland.",0,0,0
7po0Q__DY7V4vbeeBK30Yg,R_BzrnYgVFd0n43Jw3AVmw,JMiaNitMzMbJm6Kh0RbT5A,4,2015-12-10,"Came here for a staff Xmas party at the end of November. The view is spectacular and the staff were excellent and very attentive. The food was very good though not everything was a home run. 

We had an assortment of finger food to start. The beef sliders were fantastic! They had a hint of truffle oil and were cooked nicely medium. They were a little awkward as finger food but delicious nonetheless. The samosas and lettuce wraps we had were ok but nothing special. They brought out sour dough bread but were able to also bring out some corn bread for one of my colleagues who is gluten-free. The corn bread was to die for and was so good that we got an order for all of the tables!

My entree was grilled tuna that arrived quite overdone. The staff were very accommodating and quickly got me a new one that was cooked perfectly though overall was not as tasty as the smoked and pressed chicken that my colleagues ordered. 

The butter tart for dessert was fantastic, warm and gooey though not particularly special as far as butter tarts go.",0,0,0
EFMamAzMkcxr3MSgDMDGnQ,kcLuh-ck_Zj07TsodaaNUA,Vy3geS_HXBY0FQttgdHa4A,4,2009-05-13,"With decor that befits South Asian Fast food hole in the wall, Jaipur Junction delivers exactly what you expect... punchy flavours in copious quantities at reasonable prices, but without ingratiating service, or really delicate flavours.

It's exactly what you'd expect.

Yesterday, I had 3 curries, all of which were warm, but not *hot* in terms of spice.  They were creamy -- and a tiny bit heavy for my tastes, but very edible.  The menu is a mix of northern and southern indian, and is in larger portions than I've had around CLE.  You can get idli, dosa, roti, and paratha here... as well as many other fan favourites (yes, from many regions; thanks Vasanth!)

Given that I live right next to Saffron Patch (Will review tomorrow!), I think I'd rather go there, despite being a tad more expensive.  Yet, if one is in Parma, this is definitely a good place to go.

Heavy handed, but quality.

Got it?",6,2,2
xliaIVA_sJeXBQDIdC_xiw,O59tMORnKjqqHjoXDcntIQ,ogCsAKIXDEb294Uvg_rMTg,5,2017-06-26,Had a huge rock slam into my windshield a fee weeks ago. Any repairs to a car always sucks.. but they made the process of replacing my windshield super easy and convenient. Plus the customer service from start to finish was nothing short of exceptional. Thanks so much!,0,0,0
Ip3HsWrEozC6NBtpHfIV6Q,a2hjLslKGIy5mQabvxwlow,4kbq0sap6jHLHFX8eHlv3A,5,2017-08-11,today was my first time going to this salon and i have to say im really happy with my service! james did my nails and they turned out perfect he was quick (which i like) but made them look perfect! also sam did my pedicure and he was so sweet and talked to me the whole time i hate going to nail shops and its so quiet he made me feel very welcomed. ill for sure be going back! thank you james and sam! great service,0,0,0
6d9lJJYo3bf_e-8XWqhqwg,3uFCBzz6Q5ti9RukQ9zTbA,brAUHv7Kmxx5nclssCPldA,1,2015-09-05,"This is the worst Ramen place in Las Vegas. And I will never ever come back again, it's not even a ramen only 2 ramen to choice and the soup is horrible.",2,5,1
yf_Hg3FSiUfPR_begtb3QQ,Sh573T1yCq8j6hPSwB_aSw,Gswrq0e0dLBXIBCwN7OzmQ,5,2017-11-09,"Lovely pub, big layout. Good food. Good music. Lovely staff. What more do you want??",1,0,0
Nk2ycrkbi0N8CjxKRUuE3Q,zGHuQJjzDOy2iz5ZJwWfCg,THfsY3HTXVVU4NnyK4jvaA,5,2017-09-20,"One sure thing about this 'Food Truck'  Perfect 'hole in the wall'!  Their bbq ribs, 1lb. beef smoked brisket, smoked chicken wings.. TOTALLY WORTH every bite.  This place will be my to go place at least once a week.. maybe twice.  Flavor in every bite!  Don't miss this 'Hole in the Wall Food Truck'",1,0,1
aW16l1HCTw94j_vlx5qT3w,Vfti4k9v_KO2lhExBBS1KA,2NICrHy0I5rlEJmlt0ao9A,4,2015-09-06,"(written by susan) One word - YUM!!!! Had the blue cheese burger (they have 2 versions) and small choc shake - wish I had ordered the large one! Just like the burgers and shakes I grew up with in the 60's! I am hooked. After a lunch at Indian Village, the next day's lunch will be here at Big Earl's. Great service and yummy, old fashioned burgers and shakes done right!",0,0,0
nMlV97FkcP0Ye2thBY2emQ,3LfBF4dfJZW9Nbs_o64GVA,64o_nYvzIKwHFOSYSEm-qw,5,2015-08-08,"Crust perfect- thin and crispy. Sauce perfect, not too sweet. Loooove the pizza! My husband had the meat pie calzone and was in heaven. Great place for eat-in or delivery! Wish they were back in northern Virginia!",0,0,1
wDcmodztYKUdmLBJTym6OA,S9BuuXMBSTkyISrSb0rG-g,kDwipxJhOo6ChaLZ053XYw,5,2017-03-24,Charles is my go to guy when I am visiting the area. He can style your hair anyway you want. My style is kinda straight forward but I am quite picky to select hair styler . Charles has been very accommodating and the cost is very competitive. Try him and see the difference!,0,0,0
SVwBGTm_JpbLpE0yltJn9A,LLgTAp0F5HkgJjlIFwDSRw,aT_SsfZ6GQgJGyuIv1Hapw,2,2011-01-19,"Damn you and your beautiful pastries.  No, not because I can't stop eating them.  But because I'm convinced that I keep ordering incorrectly, and surely something in that case is as delicious as it looks.  Turns out, that's just not the situation at all here.  

You get a solid gold star for strong, delicious coffee, but I'm done handing over my hard earned cash for disappointing baked goods.  They're just not good.  The red velvet cupcake was dense, almost stale.  The chocolate chip cookie was dry, dry, dry.  

Thanks, though, for the coffee.",5,4,3
RKUdb1SGMnCI22612TRMwA,R4I5x03IW-XQ5ZRfxVsvsQ,0cFCPxFRWReXer2D_mCp1A,4,2008-07-19,"Went to the Last Exit to see Shelby James and the Crying Shames play last night.   I thought it had a cozy comfortable vibe. It was my first time to the club and I enjoyed myself.  

The club is a few doors down from REI in the corner of a strip mall, plenty of parking and w\/easy freeway access.  

The main entrance to the club is through a small smoking patio ringed by misters with a half dozen high tables, roll out bar, and on this particular night, an ice block ""luge"" for taking shots.   Off to the side there's a hole in the wall pizza place that you can enter without having to leave the patio. 

I love being outside on the patio during the warm desert summer nights, so having the patio is a plus for me.  It's also an opportunity to give your ears a break from high volume levels when the band is playing.   The water pump for the misters should probably be moved up on the roof and out of earshot however.  Listening to that thing hammer away all night takes away from some of the ambience. 

Inside the club I remember it being exceedingly *dark*, which suits me just fine.  From what I could make out in the blackness, the decor was spartan, understated, and more or less contemporary.  The men's room smelled bad, but it wasn't a disaster.  There was no lock on the door though, god forbid you had to drop an ""emergency deuce"" cause you'd be putting on a show for all the bystanders outside.  Overall, the place is pretty nice and not your typical shithole music dive.

There is a full bar and a decent selection of beers on tap, but the major downside here is that draft beers are served in clear plastic cups.   So my first drink of the night, a Kiltlifter draft, got warm prematurely.  After that I switched to a shot of Hornitos Sauza to sip while knocking back a salvo of Pacificos for the rest of the night.  I didn't have any mixed drinks so I can't comment on how the pour is.  Beers were $4 IIRC, wells approx $5.   Door cover is usually ~$5-10 weekend nights, $15 for out of town acts, no cover weeknights.  

The sound was good, and pretty f'ing loud if you ask me.  Bring earplugs if you don't want to sustain temporary hearing damage and a bout of tinnitis the next morning.  

So far as the crowd goes, it was a good mix, easily more than half female, undoubtedly due in part to the good looks of lead singer Shelby James.   I'd say it was mostly late 20s-30s.  Everybody we talked to was cool, no attitudes, creepiness or aggression from what I could tell, aside from a brief spat of drama with a couple of girls out on patio later in the night. The staff was friendly, good humored, and attractive.

All in all a nice night out.",2,2,2
Dw-uItIk2X9syIFaTsNHtQ,A9dr0AdI_HnZHvSglcK09w,0wKOp9CBQbiByRn8Qp7NIg,5,2011-11-30,"While this hospital may be far to reach for those who live north of Phoenix, it is worth the effort to drive there.  The highways easily get you there, with easy entry to the front door.  We were greeted by 3 nurses at the front desk, and although we had hastily arranged the visit, the doctor was available to us on time. 
Dr. Levine met with us for nearly two hours to make such a difficult assessment seem easy, but to make sure that our small 14 year old dog was comfortable and acted at ease - making for a better diagnosis..  While we were hoping for good news, the assessment showed a possible brain tumor on the right side, that would continue to progress.  
Watching our dachshund's coordination fall away for only a few weeks before the visit we knew it was not going to be good news, but we definitely felt Dr. Lavine's care and compassion for our dog.
Over the past few months Dr. Levine has continued to monitor and care for our dog. He immediately followed-up on the seizure reports we filed, and took great care in making sure we understood, compassionately, what to expect next. His technical knowledge and social intelligence is well appreciated.
Everyone is super intelligent and caring at this specialized veterinary hospital.  I can't say enough good things about their care for my dog and my family.",2,0,2
Nz4akoZ0_35iduDqi4biWg,uOgkkPKm-fKGlrKmUBBM5A,ILsriVciEvq9FGwyK9a6Bg,1,2015-09-19,Trucks drivers are the reason these companies have bloom. We spend millions of dollars in fuel. We would appreciate a clean shower stall. As I enter my shower that I was assigned. I notice I was not provided a hand towel. Just 1 face towel and 1 towel. The shower was soak and wet. I have never purchase a shower and the shower was soak with water as if someone just took a shower 30 seconds before me. The toilet was filthy.  There is no hair dryer provided. Every truck stop I have stop at has always provided a hair dryer so we don't have to go outside with wet hair. I'm very disappointed with this Pilot. I will NOT fuel or shower at this location again. I will also advise my colleagues to stay away from this location especially if you are in need of a shower.,0,0,0
3gCrAhgSgjoO0dk3zKXk1A,8WdVZJTUNU62N6185bWAIA,pquz4eXd3uh-BauXiIDotw,4,2015-07-14,Top falafels!!! Came here spontaneously during a conference and un expectantly found some wonderful smoothies and sandwiches!,2,0,2
JvZ2JQ7yG1LjIcuIO2-v6Q,-6qCRPq5QdFPS4ru4_EMfw,6frPvwX14wDH8jju64ewRg,4,2014-09-16,"Great location and space.  Service was wonderful.  Bartender was great.   Drinks, food and desert were all great.  Trust me don't pass up the deserts.",1,0,0
LTletVrenmR5A4vtHLXJ5Q,b-2GY2VKSDaMq769MwTtpw,L-GUZ7BTcAmhDGi5Dd00KQ,5,2015-02-07,"I called to see if I could replace my tint on the front windows of my Lexus IS. Excellent price, excellent work and excellent service. My car was done within 45 minutes of getting there with no appointment made. This is my new tint shop that I'd highly recommend that you at least consider.",0,0,2
_GMp4n8h7mpKAoOT-Mg49Q,RbAT_HKkjAIQCi-SIuhQcw,z1r_kSIQfxt4OWIUMRMyuw,1,2014-06-14,"I came in to your dealership on June 13th 2014 to get an oil change and to get brake fluid replaced.  I have new aftermarket rims on the car.  They came with a brand new chrome key for the lock lugs.  When I got home, I noticed that a very worn black key was left in the trunk instead of my brand new and unused chrome key.  When I spoke to your service department, I dealt with Rochelle and Todd. Both denied that this had happened.  Rochelle even claimed that she removed a black key from my trunk. This is a 10 dollar item which was stolen from my car and replaced with an old used one.  This dealership is dishonest.  They do not value their customers and won't make things right.  Instead, I was accused of lying.  I will never take my car back to them.  Too bad as I was planning on always servicing my car by Mazda.  Shame on you Dave Wood Mazda.",3,0,0
xnOcRr2L6W3Amuc5xj8b7w,ktF7Gg8Qa7hZnphNP6I60Q,I7Pul0LHzPlLjd4HAuqxzw,3,2015-12-11,"Hier bekomme ich eine schne Auswahl an vielen Kleinigkeiten aus der griechischen Kche. Ich hole mir hier dann aber meistens nur einen Zaziki, Peperonis oder kleine Fladenbrote. Der Zaziki und die Peperonis sind meistens lecker. Wir hatten zwar schon, dass auch der Zaziki mal so geschmeckt hat, als wenn er nicht richtig gekhlt worden wre, aber das war bisher nur ein- oder zweimal in den letzten Jahren der Fall. 
Was manchmal nicht ganz so schn ist, da ich dann nachmittags hierher komme, dass das Fladenbrot teilweise schon etwas trocken ist, da es seit lngerer Zeit an der Luft liegt. 
Auch warme Mahlzeiten knnen hier eingenommen werden. Dafr sind auch einige Sitzpltze vorhanden.",5,0,0
AMbyNNkyFAsid4UWQaJ6mQ,r_ZVAjB8t4OFpL3DNihCXA,8jvNcyIK8Cf1YLLSFwjwbw,5,2016-02-07,Been coming here since I was a teenager and I love it. My last haircut by Donna was the best I've ever had. I got so many compliments the next day! I'm usually really anxious about getting my hair cut and she made the experience a breeze.,0,0,0
5dzx25u7Y1KBAPAV5h_FXA,ubSobb7uwbVHj-bTNWW7OQ,CZHFDuUVWdb9eYQ_ix4nsQ,5,2014-01-22,"First time coming here! My nails and toes were in desperate need of care, and now they look and feel amazing. Very impressed with everyone here. They def. take the time to make sure everything comes out perfect and they really cater to your needs. The place is really clean and well decorated. My mani\/pedi was pretty expensive, but well worth it for the care it needed and the excellent service. I'll be coming here when my nails and toes need some extra care ;)",3,0,0
