review_id,user_id,business_id,stars,date,text,useful,funny,cool
Is7HEeScCyzSpH7OFziHNA,TcftfHJS6IECjmLudxxgnw,2YDtLCjz_glt6-Zv48Hu2w,5,2015-12-15,Came in with my husband for his monthly haircut. This place is awesome! The vibe is so cool with it being a guys place for sure! Thank you for a place that caters to the men we love. My husband has never had a better cut! Eric is a perfectionist and it shows with the precision and time he takes with each client and he is booked weeks in advance. If you have a beard this is definitely your spot!,1,0,0
e9UE531B4PfJndbai2CoTw,JYa6loCU2cnejrjjCKN3DA,R6dsQhkBRq2qwwPnqommKw,2,2017-06-15,I give it two stars because we stayed here two years in a row and the first time was wonderful but the second time was not. The second time was for my mom and aunts birthday who travelled 2500 miles and we rented a cabana at the main pool for the day (which isn't really cheap) and we decorated the cabana and ordered a beautiful cake (from a Phoenix bakery) and when I went to bring the cake in to the cabana I was stopped and told I could not bring in outside food (which I was told all week and knew from the ridiculous bag checks they do upon entering the pool area) because they want to make as much money as possible having people buy their food. Not even snacks for kids were allowed. I had to hide them deep inside the bag and wrap towel's around them to bring in snacks for my ONE year old. Anyways the rented cabana that we spent good money on and a week at their hotel which we also spent good money on and they wouldn't let us bring in a cake for a birthday into a cabana. I asked to speak to the manager and she was rude and wouldn't even hear me out. So frustrating. I had to walk back to the room and leave the cake there. For my family's yearly visit we will be going elsewhere.,1,0,0
AZfsQtxyJXd9k_WuztCK0w,Qd6dZCL3ZvIRlaT5AYEdCw,9Ri_yKX5aaysX4qCI2S3wg,3,2013-05-23,"Its a nice little place. We stayed there for a long weekend. We were looking for a nice and clean hotel close to downtown Montreal. Unfortunately, it wasn't any easy task. Most of the hotels are pricy... This hotel came across our search on trip advisor and had  mostly good reviews. We took our chances and were satisfied. It was close to Old Montreal and all the fun places. The room was a bit small but again clean. They also had breakfast ""in bed"": they would leave a basket with some muffins, yogurt and fruits for you by the door. I thought it was a great idea as I like to have my coffee and breakfast before I go out. Talking about coffee...the only problem we had is  broken coffee maker in the room...but they had coffee ready for you downstairs in the lunch room so it wasnt a big issue. 
All in all, great place for the money you pay, clean and friendly people.",0,0,0
kUzgAAQt0QsIr_2CC6cT2g,a5a31ZZb0ZfqTvH0HUyOFw,v1AE1LLWDOqe8ubOzqKADg,1,2012-11-14,"Food is mediocre.  Everything taste the Same.  I think they are using the same pan for everything...bacon, pancakes, etc.",0,0,0
050jmKZtJ1g0r7XjWhlVLw,gMvTe2Vm4-l79jH3apmbog,SMPbvZLSMMb7KU76YNYMGg,4,2013-10-01,"Got a comp'd corner suite here, so my friends and I decided to make a Vegas trip out of it. I would definitely come back here just to go back to that suite bathroom. I mean, the service was great and dealing with the front desk was much better here compared to many other Vegas hotels... but the suite bathroom was pretty legit.

The suite was a fairly good size and had a separate living room, king size bedroom, one full bathroom + one half bathroom. The full bathroom was huge and included a standing shower, large isolated jacuzzi tub, long sink area, and a technologically advanced toilet (I was too scared to push those buttons..not sure what would have happened to me). 

Talking about technology, the whole suite was pretty much automated. There's a tablet that allows you to control the curtains\/sheers, temperature, lights, and maybe even the toilet (seriously I have no clue what that toilet is capable of). It was awesome to have the curtains set to open at 10am to wake up everyone after a long night of Vegas antics. It's a corner suite, so the whole room is pretty much covered in windows.

Would I come back and stay here again? Well, I did have really good luck at the blackjack tables here, so that's a plus. I don't think I'd stay at a regular room for the price, though. If I got another free corner suite? Ohhhh yeaaaaaa. Maybe I'll even pay for the suite too if I get it at a good rate. If I do, you can bet you'll find me lounging in the jacuzzi, champagne in one hand and that tablet in the other hand messing with the curtains (or maybe even the toilet - I really think it's possible ).",1,2,1
-pPUs5pZPYIHxmzk_sr-3A,SvfcFwdWna_IWdgSFOzUvA,4iKll2kZ8xZghREXmYgM2g,4,2013-12-06,"Had a good time, some lookers and some fugly chicks.  Gotta watch the dances though, some of the girls will try to get you mid way through a song and then stop and ask if you want another dance.  You gotta tell them on the Next song give me a dance.  Take out was def on the menu with several of the girls.",5,3,0
qUNrIUvXOpcehjAGf2mkLA,3U8NLU-_7A6oaWQHB1l6Vw,_nB8HNT2IDRhlAoY9TPYew,1,2015-05-16,"Woefully unremarkable, even for land-locked sushi bars. Will avoid going forward.",0,0,0
G6iP5EqQIsr2ZI8GQ2OQgQ,tzdz5CN4ss0Ipogkp3Eiyw,oQFMJqDwNXbNMRbcmIYRYg,3,2017-07-14,"Good coffee, above average wifi, indifferent staff bordering on rude, atmosphere too dark and noisy to get any work done. So...choose what's more important to you. For me....the place was too unwelcoming and too chatty for another visit.",3,0,0
Ag65rgkrHpZGfGgtJcLoNA,dBMv0WSKWILE69G6NEcivQ,Eo0lN0i316CMDaAvG6EiuQ,3,2013-07-17,"This is a small pool but good enough for my toddler!

I signed her up with some basic swimming class and  I really think they have some great instructors like DJ, she learnt a lot within the 2 weeks, 8 sessions class. I continue to sign her up in another class, the current instructor is equally GREAT too.

After the class, she usually play in the baby pool and easier for parents to keep an eye on their kids. Unlike the Hamilton Aquatic Center which I also signed her up on weekend class, the instructor P doesn't seems to know how to teach...

If you're looking for Toddler\/kids friendly pool cum great instructors, I would recommend Folley Pool.",1,0,0
E0_9JH2IEWty2j6I4s3dnw,tKAM0Qyg-8SeBla-DfUbgA,ly0SNB5mUdqkYW_pj-M9wQ,4,2016-01-31,"Food was delicious and authentic. So if you like Filipino food or want to try something new, this place was great! I recommend the kare kare - contrary to the first review - as it was a very good version of the dish. This oxtail stew is supposed to be in a peanut curry sauce and have a savoury and slightly sweet taste.",0,0,0
-SdBxQFz6gyElQiYTd3DAw,TNlioiWi_CpIxq4t1mklNw,f4vb5tv60WaBcwzRhKpANA,5,2015-05-14,"I absolutely ADORE this place. I come here a few times a week and get their vanilla roiboos tea and some of their pastries. Their madeleines are to DIE for. So delicious with a cup of coffee or their organic tea! Their sandwiches are fantastic, as is their chicken salad. And the best part about every experience is the SERVICE. The women who work in the morning from around 9-noon are absolutely fantastic, always sweet and kind. I haven't eaten there in the afternoon, so I am not familiar with who works at that time, but I am betting that they're great as well. One of my favorite places ever. Thank you Nanny's for your fantastic service and delicious food!",1,0,0
Hp6x2CKnEPaFUqZw8i2IKQ,LUL2M-R107_ovqrLqg7d6w,Gaq3S9lmjXVcuDCZ8ulppw,4,2012-08-14,"Oyshi means ""delicious"" in Japanese and this restaurant doesn't disappoint. For local Las Vegans, this is the spot to go for delicious sushi!  Locals drive from the North (about 30-40 minutes away) just to eat here.

Sushi is fresh and tasty. Get the Nuclear Bomb and the Heart Attack! Even the dessert is good. Get the creme brulee!

If you go for dinner, make sure to choose all you can eat, otherwise you'll be paying buckos! All You Eat menu is anything except sashimi. As of this writing, $26 for All you can eat dinner, $21 for lunch. It will be worth your money.

Waitstaff is casual and easygoing. They play EDM music in the background which keeps the atmosphere upbeat and fun. 

Only reason not a 5 star is because there usually is a wait. Everytime we've gone, we have had to wait 20-30 minutes for a table. 

But it's always been worth the wait!  4 stars for us!",0,0,0
nEiIGV-mXRpWlxtpyJLy4g,Omhu17Pu7pGbO7KjbYLj1A,xYeLEIWbG0IBnMGU2mWUBg,1,2015-11-23,"just want to get this out of the way. i absolutely HATE korean bbq, but i'll try to be as unbiased about this as i can. I just don't like the idea of paying to cool my own food. paying $30 at that. the only reason i came was because it was a friends birthday.

how many people can even eat close to $30 worth of food at a kbbq place? it's so expensive. all you're doing at the end of the day, is throwing pre-marinated meat onto a grill. i'd really rather go spend my $30 at a nice restaurant and get a nice rare steak. often times, you're either over\/under cooking certain meats and sometimes burning them cus you forget while in conversation with your group.

the only things i actually enjoyed eating were the beef ribs and pineapple. speaking of pineapple, Brazilian steak house would be even better. WAY better.

however, obviously, people do for some reason like korean bbq. so there must be some sort of appeal to it, and if you like it, then maybe you'll like this. or if you haven't tried kbbq. maybe this is a not so bad place to try it.

verdict: i really don't know why people are willing to pay $30 to cook their own food.

I really hate to do this. because i always want to give places a chance. but this will have to be my first 1 star review. sorry.",2,4,0
TuHxvJjPoqgZv_wqxIyCrw,yGRqCJbcbGztv5KNbR47Gg,r8kvUbiKKXW54lDFtMebnw,5,2017-11-09,"It's all in the name.  These guys are truly experts!  The customer service is amazing.  Bo and Brandon were super nice and very easy to deal with.  They were very informative and knowledgeable.  They retrieved lost files from a toasted HD and put a new one in my desktop tower.  They even backed up my files on a flashdrive that I provided, as a cautionary measure.  I felt at ease with the whole repair process.  I will continue to do business with them in the future, if need be. I typically don't write reviews but Bo and Brandon, as well as the business, deserve a good mention for their excellence in customer service.",0,0,0
jW4kQAnVXxiC-w6iPC2wkA,PIsZjx6DSYrwNgPSWlx8Lg,8TBt9XAVZIZR2Y0EqBHskg,1,2017-02-17,"They told me an hour and 15 minutes.  It's been 2 and a half....And counting.  It's maddening.  Their excuse?  ""Oh, one of the managers left and didn't tell the other manager it needed to get done."". Wtf?!    Waste of time and $95.",0,0,0
2joY3xkx0H9sXqClBxWfKw,4-CD7Gmj0qF0i-MvoF08RQ,ChQmxnYLSVIQkL8Ct8z55A,1,2015-10-07,"This is a prime example of a horrible restaurant, with horrible food,  and minimal service that is just taking advantage of being on the strip and overcharging everything except their wine. The bread was not good it seemed steal to me and store bought,  I didn't even finish my oysters on the half shell, which I would normally view as a crime, I could tell they used alot of breading in my stuffed shrimp... Instead of crab meat,  my entrees presentation reminded me of a school cafeteria lunch which is also how the potatoes and broccoli tasted with absolutely no seasoning at all. I normally don't write reviews but I am pretty upset that I just spent $60 on a piece of crap meal was pretty bad service. The waitress came over to me only when I got there to get my drink and order and then to give me my check and that's it. I hope that my review deters you from going to this place and spending way too much money for not very good food.",0,0,0
VCwz1T32ztDv_GN-QlmrHA,S4WW_eTSOftwSJxqyW9KKA,sf5jTm__NNqZ3J5rbcrueA,2,2014-05-08,"I should have set my expectations appropriately for a Primanti's location that was not The Strip. The building was nice, the service was ok at best. Our sever seemed to have a lot of tables and was hard to flag down. The small parking lot sucked, I had to park in the overflow lot and walk about half a block. 

But the food was what I came here for - it had been a long time since my last trip to PGH and a hot on a heel, with fries and slaw on it. It was not great, it was pretty dry. My wife got a corned beef, it was as dry as the Sahara. Our fried zucchini app included several ""exploded"" ones that I wouldn't expect they'd serve. So this was a pretty disappointing visit, and the food sat like a rock in my belly all night. I should have picked another Pittsburgh tradition this night.....",1,1,0
nKDQlUAM-5LTxU_XdAslMA,2JRzKU0fRdgmJkamcHXKiA,2_8YGZegR6uMiCJX5ORSnQ,3,2012-10-12,"I have been to Alfred Angelo twice, once for a bridesmaid dress and my most recent trip to look at wedding dresses for myself.

Customer service has been good.  The first time I went in for a bridesmaid dress I didn't have an appointment but one of the consultants quickly made time for me to try on a few dresses.  When I was wedding dress shopping, the consultant assisting me, Jantelle (I think) was extremely helpful.  I had initially set an appointment at Alfred Angelo a couple months previous at a wedding show otherwise I probably never would have went dress shopping there.   Ultimately, I just didn't care for any dresses at AA, they just seem very mass produced and nothing special.

The dresses themselves were probably 2 star but customer service was a solid 4.5 stars.",0,0,0
rjWik75ic-MkYVhDETkS-Q,VJhwUC6Z2qrCdWrnjYFEWQ,eDuMXO2tup9jrkBEP7_-cg,5,2011-03-29,"gut sortierter Laden, letztens erst einen klasse Leuchter gekauft, aufgehangen, angeschlossen - ging!",0,0,0
vAcHAUBOHgT58vcCzQv6kA,pnrG47iwW26dDyHCwEr8UQ,No3BsB8fFF03WmRPs1d7tw,5,2009-02-19,Awesome set and great special effects.  Well worth the dollars.,0,0,0
FhX3DeNsIs2mBWyRUGisNA,hSTQa4VovgWTil21ONgCng,eSgl0p7qFmQ4Wb4kfE05kQ,5,2016-10-12,"I am so happy to have found something as unusual as a honest and knowledgeable Mercedes mechanic with reasonable prices. No bullshit or gimmicks at all, everything is perfect. These guys are heroes!",0,0,0
sU40uXynnE15tlBHkmYO_A,wBuxfSMK8dJsw_oW0FVO_w,HRyzcsHwCuwDKD6SNhc4Tw,3,2012-05-21,"I found the front desk staff at Rowdy very friendly and attentive. I love that they use Moroccan Oil products because they are my favorite products for taming my thick, frizzy hair. My appointment was with Stacie. She was very sweet and gentle. I guess I just expected to walk out of the salon looking like I'd had my hair cut. I think she just didn't have the confidence I was looking for in a stylist and maybe that is because I was new to her. In the days after my visit, I didn't receive one comment from friends or family about my hair. No one even noticed it had been cut. Despite asking for 1 1\/2 - 2 inches off, I felt like I didn't get any more than a 1\/2 inch off and I spent almost an hour in the chair.  I would expect that from a $10 cut at Super Cuts but not for the price they charge. I may or may not go back and give them another shot someday.",3,0,0
_lww71Gs3hohZ03C6Cm6Gg,RyoTi4p5nfvWhxGjrWmCkQ,wHq1efQVz17338k_aUOX3w,4,2017-08-03,Cute little coffee shop with a great selection of pastries to compliment your drink of choice. It wasn't very packed when I was there but I kinda like that. I'll definitely be back! Gotta try some of those pastries!,0,0,0
aK93EHj2rRvtd--Z-Il8NQ,4zGUfXRDgbLktXsYf0sHjQ,2DMxJUDUlHiS7P_GKDPvxw,5,2014-05-07,"I had written my previous review of Goodyear after a frustrating experience. Within 12 hours of posting the review, I was contacted by Shane, the District Manager of Goodyear in hopes of resolving the issue. This is the quickest response from management I've ever received after a discrepancy. I am blown away by how apologetic and accomadating Shane was. 

Prior to contacting me, he had pulled up my invoice and admitted that there was certainly a mistake that was made. He offered me a refund of the overcharged $100 and an explanation. 

This was simply a misunderstanding with a new staff member who was not informed of the promotions in place. From what I understand after the explanation from Shane, Goodyear does offer the ceramic pads at the promotion price. 

I don't exactly understand what the original sales employee had tried explaining to me at the time of payment about the different brake pads that are used, but Shane assured me that Goodyear stocks quality centric pads. 

This review update is simply on the urgency that was taken by upper management to resolve customer issues regardless of how large or small they might be. Goodyear is lucky to have an employee like Shane overlooking their locations.",13,7,9
9U9OZUZ1kpBcDIPx9qfcIQ,VxdBd4XPX8Y45PM9IlqIrg,pMiz7SP82Tknv1NbVqoSfg,5,2017-04-14,"Great expansion to the first location, the food is still the same excellent quality and price, now in the much bigger location!  This has greatly reduced the wait time for me to get my favorite bbq and twice baked potato casserole fixings.  :D",2,1,0
oh96-YKoDrE2dNCdtZMXkQ,H-Pzp3IK_mfhQaIh9IKHvg,698nukvxe7mq2Fra5vDikQ,5,2016-05-21,"My first trip to Rise and Shine was to their Southern Highland location a while back.  We loved it and were in there often until it started getting so packed you can never get in there.  I was sad about the traffic but what can you do? That place was so good ... great breakfast and great service ... that it deserves all the demand!!

I was excited when this location opened!  But my first visit was disappointing.  The service was slow and not so great.  I've since chalked that up to growing pains in the new location.  

Today's visit has been wonderful and exactly what I remember from my visits to SH location.

I got the Ribeye & Scrambled Eggs w\/ their pot of bread.  The PoB is a flower pot or coffee cup with a light fluffy cinnamon bread baked in.  This is so fricken cool and tastes good too.  The steak was perfectly cooked and seasoned.  I also recommend any of their oversized bagel sandwiches.  

This is a must visit for anyone up on the west side!!",0,0,0
H6oXPlUUttRWWZnJfV9XUw,_K5SzUBpqtV9eID3JpmecA,WsOqIVMIVshUis9kUkG0KA,5,2010-01-24,"Niagara Street Cafe is a great little place. Super friendly and delicious food. The brunch is awesome, and it's a neat little quiet spot for dinner. Very cozy. The staff are really nice and seem to be into the food too. Not pretentious which suits me fine! Yum.",2,0,0
jZRMZ7QyW9xjsC-0VnbWcQ,LHZfiocfMPBlqu-6vONF_w,FaHADZARwnY4yvlvpnsfGA,4,2015-06-21,"McCarran International Airport is a bit like Dr. Jekyll and Mr. Hyde.

Nothing let's you know that you're in Vegas like flying into McCarran International Airport.  From the faint smell of tobacco to the flashing lights of the slots machine right at the gates, you know that you're in for a good time.  

If you're flying in from the East Coast, be prepare to strip off layers of clothes as you hit the furnace known as the Las Vegas air.  Queue up at the long taxi line, but no worries, it usually turns over quite quickly.  

The flight back home from McCarran is another story.  The security line is usually long and filled with disgruntled travelers who lost more than their dignity will care to admit.  Be sure to factor in enough time to get through security.  You'll need it.",5,4,4
0diKZjfCPGCNQUTdW6hJaQ,3_4-eRoGsGUj_LI0InHIDw,6Hh9JlNaxyiAdb0secIVxA,1,2012-05-25,"We went here a few weeks ago and I was less than impressed.  I'm not a huge fan of sweets, but frozen yogurt is my weakness.  I tried EVERY flavor trying to find one that was to my liking and they ALL had an awful aftertaste.  I have never ever ever ever been in a froyo place where i couldn't find SOMETHING that i liked.  Also, the girl behind the counter didn't seem to want to be there.  I know it's not the greatest job in the world, but a smile would have been nice.",2,1,0
XmuE1H6EWj8XIIazitAn_g,nXMMoDzXRByQiWH9cf-FAQ,s0QR_loWfMC2-ihWaKDT-Q,5,2017-04-22,"2017 Updated Review:  They no longer have the cafe that was attached to the store. #sadface 
I still love this store though. I try to come here at least twice a month to trade in my magazines and other what not. I'm all about recycling, so I'm glad this store exist. 
They have a large selection of eclectic books for about half the original price. The books are in good condition and the place has a peaceful friendly vibe. Lots of recycled records, cds, electronics, vintage home decorations, and arts and crafts. I always gravitate to the travel and art sections since I'm always traveling, and of course into DIY.",3,1,3
QzfAUSnxkkwYrFgMWG4obw,U2cTPixd8mQxM6CHmacHgA,QJatAcxYgK1Zp9BRZMAx7g,3,2015-11-27,"Meh... I don't see what all the fuss is about. The burgers are good, not spectacular. The frozen custard was nothing to write home about. I had the ""shack attack"".  I much prefer in'n'out for both their burgers, and those delicious shakes. Better prices as well. But if you're on the strip, and craving a burger, Shake Shack will probably hit the spot.",0,1,1
p9qxOgd7-1cvzxijRuCjdg,Ce9vPho0OnX2JrJ8VEjd_A,ubKkQVXUZy6mjcEWhRzesQ,4,2016-03-20,"Very tasty rotisserie chicken. I had 1\/4 white and my wife had dark meat meals (with a side dish and a roll) for $15.99 with a coupon. Also offers BBQ, steaks and ribs.",0,0,0
wJVU8eWhjdGvhqiTBDTD6g,xsBjO0GTAvZK8i2A8_z20g,Kn57RIWAdnVfJHI1loLXOQ,3,2015-06-15,"We are downtown people and went all the way to Scarborough (!) to get some Hakka food. 
The food was okay. I was pleasantly surprised that they had Caribbean food on the menu as well, that is not something I have seen offered before, and the chow mein with a Caribbean chicken leg plonked on top was delicious. The corn chicken soup was also amazing. 
The other food was alright, definitely not the best Hakka I have had. We ordered the veggie pakoras which were surprisingly disappointing. The chili chicken and dry beef and shrimp were all okay, but not great. Definitely watch out for them if you don't like spice - they have a serious kick. 
The price was great, though. Really well priced. 
The waiters were very kind, as well, and we got a room to ourselves without reservations, which was a plus.",0,1,0
OLZhTFr-jhZGLWwYVcoCsw,T7Nhxux5ao3Bk7ItFhpuig,DGK2scJteV6vyvJ2xeOYag,4,2017-01-28,I work nearby and frequent Brew Garden for lunch. The staff is always friendly and the sandwiches are great. I recommend the Knife & Fork Sloppy Joe. In the winter grab a seat by the fire place and fish tank. In the summer grab a seat on the patio and enjoy one of their many beers on tap.,1,1,1
vNT-tFuB91uPxa2jRKcAew,1-odnpMCU9Mo_RU97M5xmw,pZ6Jh_x1zKtrCdJOU8uBjg,4,2009-10-26,"instead of visiting so many stores how about go out and visit museums or a library so humanity will prosper instead of know what's in this season. anyways i like urban outfitters, i actually shop there but i'm just saying...",0,0,0
Erp9DMyIH2FoNZCu-WKyTQ,VJKn3QiQ2B6IoQ5d9S6vGA,vsafIOqyblej4784tqbUhQ,4,2016-01-24,Had honey hot bbq wings to start they where good . Italian grinder for the old lady and I had the pastrami and cheese . Both where delicious . Our waitress was on point . We will be back,0,0,1
_3nXp1UgVjuBFCQfXvcnVg,X0dVX5OPH1tDRZXeJs-yOQ,XHrPQKUTJXJGPH9etKUYUw,4,2010-03-10,"My boyfriend used his Marriott points to book us a room here for free (sign up for the rewards program if you use Marriott often!).  The location was much better than we imagined - it's right in Yonge Downtown and just a short walk to the subway station.  We only stayed here one night, but the location made this stay worth it.  Overnight parking cost $30 valet ($25 for self parking across the street).  Room was a basic Marriott room - the bed wasn't that comfortable, but hey I'm not complaining when it's free!  The valet guys are not that friendly, but the front desk staff were very helpful!",0,0,0
RwPdasOx5d5GMEiFC9SBRA,8cpSYxl9DT0iB31uqt9M7w,iBJkMN312pYODkVPIa2U6A,5,2016-04-12,"The Assistant Manager was super nice and great customer service, will come again! The Shrimp avocado salad was delicious!",0,0,0
3w9ARVA0bj9bmoNkSgYIXA,uPzrInBrH3kR0_iRF2s2hQ,C-Dh-6YO61mwNA3caQXW4w,1,2015-05-21,"I have been leasing from Gerson Realty for 2 years now. They have been nothing but rude. I generally speak with Keenan, who is not always prompt in returning my phone calls, but will return them within a few days. I had the displeasure of speaking with Mike Gerson, who was nothing but rude on the phone. When I would ask him a question, he would not give me a complete answer. When asking him the question again because he did not give an answer he rudely stated,""You've already asked that three times, I don't know what your looking for.""

The only reason I continue to lease from them is because I like the place that I'm located at. But I would not suggest using this company. They are rude and unprofessional. They don't even have their website updated with the correct address. Even the receptionist that answers the phone is rude at times.",2,0,0
Pve117SjW00OLii5dNzUyA,3Iduj830G4wOGsSTYzLVAA,_XN-GwzZwAyIqLKJsl2htg,5,2015-01-06,Returned here for dinner on New Year's Eve.  This time I had a great experience.  All of the food was great and the portions were large.  Maybe a little to big but I'm not sure if that's a thing.  They had a special menu that night that was five courses with plenty of different diverse choices for each.  I was able to have sushi and steak and potatoes.   The flan cheesecake was a great finish to the meal.,0,0,0
Pz9S7rayli4VkqqHZqPA4w,zHCiKB53tLzGmTUP0O4XWQ,VcJUwtuimI07KQwOc1wEcQ,1,2016-01-14,Bad service twice in a row...really I couldn't believe it at first I thought it was me but the second time no way never going to this one again,1,0,0
