review_id,user_id,business_id,stars,date,text,useful,funny,cool
DOz4vg4MEhYrEyYCNvTU9Q,u9NBJh6F56I9tKcjaVE_Vw,xG2DxjHdoUf3frxogIeTAg,2,2012-04-25,"Bad experience with bike repair. 

Disclaimer: I love MEC.  They're a great company, they do great things.

I normally do all my bike repairs by myself.  I love working with my hands.  I have very low expectations from bike mechanics.

I showed up in business casual with my old beater of a bike.  The mechanic was assertive, not knowledgeable, tried to upsell and put me in a difficult situation.  

I went in to find a replacement spoke for my back wheel and deal with a chain slippage problem.  I figured my chain stretched, but I wanted an expert opinion.

They had a look at the bike, measured up the chain and said ""yep, stretched.  And we replace the cartridge when we replace the chain.""

I guess I should be tougher on these guys.  As soon as they said ""cartridge"", I knew he didn't know what he was talking about.  But I also knew he was right that my back gear cluster was worn.

So I asked him ""how much to replace the cluster?""

""$30 labour, $15 for the cluster.""

I figured.... it'll cost me $20 for the tool to do it myself, and I don't have a bench vice, so I'm glad to have them do the work.

""Go ahead""

""It can be ready in 40 mins, you can pay up by the cash.""

So I paid the bill, then came back after 40 mins.  He saw me and told me ""hey, I've got some bad news.  Your freewheel is stuck.  We can't get it off""

Then he tells me ""we've got this wheel here, it's not a great wheel, but it's better than what you've got.  Your old steel rim is pretty rough.""

""That's alloy. there's barely any steel on that bike.  This is not a Canadian Tire beater. ""

Here's where I got into a sticky spot.  I've already paid for the labour, the money is gone.  I could return the parts and head out, or I could have them swap out the wheel.  I was really reluctant... because the only reason I had them do any work on my bike was to remove the freewheel... which they couldn't.

""I could get a complete set off Craigslist for $120""

""yeah, but you'd have to find a 7-speed cassette, and they're rare""

(they're not.... but I don't actually have the wheels in hand, so... feck it.)

I said, ""go ahead, do the wheel.  Can you swap out the tire while the rim is off?""

""We normally charge, but I can let it go this time""

Wow.  He's telling me that he's doing me a favour by not reinstalling my old tire, but instead installing the one from MEC.

So I pay the remainder of the fees, come back in 30 mins, it's not done.

Come back in an hour... it's not done.

Come back in 2 hours, and I've got my bike.

""Hey, I installed the wheel, but your shifters are getting old.  They're stiff and need to be replaced.  Look at this""

He puts the bike up on the stand and shows me the bike shifting rough from the second lowest to lowest gear on the freewheel while on the highest gear of the crank... i.e., the most useless and most rough gear on the bike.

""Look at it stuttering as it can't quite get into gear""

I point to the adjustment screw on the derailleur.  It needs a twist here.

""Hang on""

He adjusts it, it moves perfectly.

WTF?  You just tried to sell me a complete set of shifters??

$120 later, I have a working bike with maladjusted brakes and a ""cheap"" wheel.  Ugh.  Next time I spend the money on a bench vice and a freewheel puller.  Never trusting a bike mechanic again.",20,9,4
3L0uqQZswAib9JKRGeBqjw,_uqIpl5tzucKuIlZZPBZRw,8N1fEkTUN73oqDPz37uHnA,4,2008-11-23,"My Dad and Stepmom came into town and decided to stay in a hotel that was nearby our house.  The Doubletree behind SouthPark Mall was the closest and it seemed like a safer area than some hotel choices on Independence.  Plus, they offered very reasonable rates (I think it might have been $89\/night) compared to other similar hotels and for the more upscale SouthPark area.   

After checking in, they were even more surprised and excited to be staying there.  The hotel only has suites!  For that great price, they were given a one-bedroom suite, so it was like a small apartment for them rather than a hotel room.  They had a living room area, a mini kitchen, bedroom, and bathroom.  The decor was nice and everything seemed very clean.  Plus, they were within walking distance of SouthPark Mall, so we could enjoy The Cheesecake Factory without even moving the car (parking is a bit limited in their small parking deck that's near the hotel entrance).  

They'll definitely be staying there the next time they're in town, and the proximity to the SouthPark area and our house is very convenient!",0,0,1
WyGvu0oGUXek_WBv-ejaxg,clZnZCWWQeB2jPK11NV_sQ,2weQS-RnoOBhb1KsHKyoSQ,3,2014-12-01,"Nothing spectacular just average, in fact I was staying across the street at Treasure Island and their buffet was better than this one and much cheaper. The hotel itself looked nice inside and obviously catered to the upper class.",1,0,0
iInqwLZTDTGfkt_-5P4T6A,_dXriYEzEc0L9GSyoccgVQ,UZ34XAw1GJ3chCOuKL69Mg,4,2014-07-16,"This is the only mexican restaurant within 10 miles of my house that I would recommend to anyone.  I've been to it about 8 times in the past year and have never been disappointed nor have my guests.  The menu and prices are pretty much typical of family oriented mex restaurants but the food is above average and pretty consistent.  The very first time we visited, soon after it opened, one of the co-owners came by and talked to us.  From what he said it's one of several restaurants owned by his family who are headquartered in TX (I think that's where he said).

One thing people need to know about ""Garcia's"" chain is that they are NOT all alike.  Some are definitely better than others.  The original Garcia's is at 35th Ave near McDowell Rd in Phx and while popular the food at the original is sub-par.  So don't let your experience at another one prevent you from trying this one.

I generally get a green burro and that's what I've gotten here.  And it's very good.  My wife usually gets a red burro and is very happy with those.  The meat is in chunks and usually there is plenty of it.  The gravy it swims in is good.  The only knock I have about the green burro is that the green chilies in the mix, like so many mex restaurants, is a bit overcooked.  Others in our party had fajitas and thought they were  very good.

There chips are above average and they serve a decent salsa and a bean dip with the chips.  The bean dip is tasty.  The service has been good to excellent.  The other restaurant I recommend in the tempe\/mesa area is Rosita's.  There is also a Rosita's in Phx but it's different people.  The one in Phx is also good but the food there is MUCH hotter, usually too hot for out of town folks who have never had what we here call ""real mexican food"".",1,0,0
IBf9CaGl0BDJhbaadp7A3g,ce63dEP3lIW6UqMGLe_lfw,1SWheh84yJXfytovILXOAQ,4,2015-09-23,Played for the first there this past weekend and it was AMAZING...my friends and I played the Links course and found it fun and challenging.,0,0,0
5pFijKDxqznB_SbP9AQ7Fg,YBOLcKutXgNazubtFMxDtw,JC7HF7jRVqULhTOTE2n6ug,5,2015-11-02,"Haggen it's new in Vegas 
I like it 
The best super market 
In town !!!",0,5,0
XltmxVpMoPmxmALHRbhypg,_NGEqqeQF9-hnyvai7OmzA,2Mp53KxlGeZJkodTuqpVow,5,2014-09-21,"I work a lot of Las Vegas and often take the monorail up and down the strip.  Every time I stop at the MGM, I immediately make my way to Project Pie because I feel that this is the tastiest, freshest and cheapest place you can get some real food on the strip.

Food:  They make all their pizzas fresh and from scratch.  You can choose to order from their pre-set menu, but I prefer to ""build my own"" pizza.  For under $10 you can choose everything and anything they put on your pizza, which I love.  The hubby usually has them pile on all the meats and cheeses, and I prefer a lighter pizza with veggies and garlic butter.  The pizzas are made right in front of you and taste so delicious with their thin, crispy crust (I'm drooling just thinking about it.)  They also offer a good selection of meats, cheese and topping, as well as a few sauce alternatives.

Price:  Their pre-set pizza items run about $9 - $11 each, and their ""build your own"" pizzas are about $10.  Great deal for the quality of food you get.  Me and the hubby usually get a pizza each and share a soda, and for about $20 it's a steal.

Atmosphere:  This place is located in the underground shopping are of the MGM.  It's a bit out of the way, so not as much traffic as the casino area of the hotels.  I actually like this because there is always plenty of seating available and there is no smoke smell.

Staff \/ Service:  The staff here are great!  They are always friendly and great you with a smile.  They make your pizzas exactly how you want it, and they do not hesitate if you have special requests or ask for extra cheese.

This one of my favorite places to eat in Las Vegas, and I usually end up eating here at least twice during my trips.  Great prices, tasty food and good service.  A real hidden gem on the strip.  It's too bad this place doesn't get more exposure as I know it would make a killing, but then again I kind of like how it's a little hidden secret at the MGM.",2,0,1
GXkDtZiT_aHHn0TWe3Lk8A,9H2o45iGH3RQu2YWbhdauA,1F6imE4hNPEEcsb9VHRUoA,4,2017-10-11,"The only good place that is open past 10pm around my house and the food is tasty. The staff are friendly and our waiter have been very good the past few times we have been there. I like their drinks and also their pizza's are really good. 
Tried their edamame last time it was bomb. Also got the Chicago calzone which was big portion and really yummy. 
They have one my my favorite beers here the sleepy dog Rover which I always order.",0,0,0
Y1ZHP6tf0m4G7umG3nlDDw,vfnd4uhS6c1vHOLvZ3l-8Q,RTegy5CUBpMK65pr8UeDgA,5,2015-07-15,"A great veggie omelet with squash, sun dried tomatoes. asparagus so fresh it must have been grown locally. Endless coffee cup and superb service. I rate this restaurant a ten and I will be back.",1,0,0
SQGk9q_IGsrId8xqsRCyKA,leyNDNVu09Ldbg5ujPWMhQ,f1ZKauu7dCB6iplmKqplAQ,1,2017-02-17,"Chinese New Year, my husband and I wanted dim sum, so we decided on Orchids Garden but they were shut down by the Health Department...yipes.

So quickly looking up another dim sum place since we were only a few streets over from Spring Mountain, we found this place.

We pulled into the parking lot and it was packed. My husband dropped me off so he could find parking. This place was crazy, but of course because it was Chinese New Year. We ended up getting seated in the ""party"" room which was almost full. 

I'm just going to list what was wrong...
1. We were seated next to a door that I thought was locked, but the smokers kept going in and out of. Eventually an employee locked the door for me as I made a motion that I was cold. As one of the smokers tried to re-enter, he was startled that the door was locked. My husband gave him the look and hand motion, Go Around!
2. The table linen was soiled from the previous diners. Ugh!
3. The tea pot! Was it someone elses tea pot and they just refilled it with more tea leaves and hot water! Their was tea leaves stuck to the top of the lid. As I looked around the other tables, they had nice clean tea pots!.
4. Wait time. I know, it was Chinese New Years.

And because the list of things above made me feel icky, so did the utensils and dishes. Even though they appeared and felt clean, unless I knew it was fresh and hot out of the wash, it was still icky for me.

Our server did apologize for the wait and thanked us for our patience.

We ordered house pan fried noodles, honey walnut shrimp, sweet sour pork, and opted for house fried rice instead of white rice. At least the food was good.  Unfortunately, we didn't get the dim sum we was hoping for.

Icky experience + icky ambience = 1-icky star :(",4,1,1
3-q1T0N9OV2QofcvWOlJsQ,_pc4XCvMzTcl2Gctc33FSQ,J5U-nbhKSnnX7DJGT6QELg,1,2017-09-13,"This is the worst. My wife and I went to eat here, it's a bit of a trek but I hadn't bee in in 20 years or so and was saddened by the lack of care and cleanliness. 

Worn out and dirty. The old owners took pride in their business. Not this crowd. 

The food I ordered was supposed to be beef and noodles and was on the specials. However, what I got was canned cafeteria grade over cooked gooey noodles and what amounted to canned dog food grade beef & gravy. I found a LONG curly hair in my gravy. 

My wife had the salad bar and it had gross browning lettuce, the cheap kind. Tomatoes were soggy. No variety. Not worth the cost. 

The waitress was nice and extremely helpful and actually apologized for my food, saying the cook had a bad day. 

Basically this place is supposed to cater to small town charm, well, it fails at that. It's also supposed to be ""home cooking "" , but I don't remember my granny serving nasty cafeteria\/prison grade over cooked food and charging as much as a nice restaurant. 

I felt sad after being there, especially when I had fond memories with my granny of road trips out there 20 years ago.",1,0,0
f4za9RcDac2qbv-Sdm91Kg,Xunsa8NoDUQBqnyNQCddLg,ggboOJmlIoA81agZ1_Ezxg,5,2011-06-23,"Neuerffnung, neue Wirte sehr nett, griechische und schwbische Kche, sehr frisch und lecker, sehr grosse Portionen und sehr gute Preise. Gemtliche Atmosphre, schner Biergarten, kostenloser WLAN Internet Zugang. Sehr zu empfehlen!",0,0,0
WVpSTxecd3FPqf_ReEluMw,3jN8O70_mcMNynEX5TaYfQ,4j8Q6sOxI_R3BEvljq7G_g,5,2016-05-26,"I used Desert Storage Behrend for over 2 years and had an excellent experience. Every employee was extremely friendly and and helpful from beginning to end. I cannot say enough good about the customer service. The place is clean, easy to access and a first rate experience. It may not be the least expensive storage service, but you definitely get what you pay for in this case!",0,0,0
L3NyQg7-yZ7WAj2lT8M9LA,O5AmFG4g6kbRky30AjIG5Q,LFs5jyYdXlzi0SpAYi1eSA,5,2017-07-06,The food is always so good but this is about our last visit on the 4th of July.  Our waiter Andrew was excellent and so knowledgeable.  Food was excellent as well.  Always a treat and such great views.,0,0,0
mOj6GJBwXLCLaxxqwMoyPQ,HTAqskZEELFGOdIkvQLaeQ,btA8NopfIYf7MAJ-KwhI3A,5,2015-11-24,"Arroz con pollo. Flavorful veggies. So delicious!  Great portion sizes, and the chicken was capital-T tender . Our hostess for the evening was so very considerate and gracious. 

The plantains served with our meal we're awesome - caremelizaton so that the edges were crispy, with sweet and fluffy center. Enough alone to warrant a return trip. 

The chimichurri served with our piping hot, crispy empanadas offered a cool and bright contrast. Can't wait to come back!",1,0,0
xY8KYLKgHlZor4ZYXgbHzg,9ATN85bbDsv396vYRaxmnA,t4bBKVXbr8bIN9nEJIobYg,5,2015-03-14,Best Indian food in Vegas. Completely delicious. Try the cheese fries in chilis. I forget what it's called but it's toward the bottom of the appetizer menu. The chicken madras was also excellent.,0,0,1
BuCWpPsv-Fy0yyGsSLD3Rw,RjKOn93-7yX-I2l81DCbOw,qb-XyoTeyCXv3Z8hricyAA,4,2008-01-30,"We had some passes from a promoter off the strip, but had to wait in line about an hour or so. I didn't mind because I didn't really wanna spend money to tip bouncers, pay admission, or get bottle service since we were a group of seven guys. I had more fun at this club than I did at Rain. It was packed to the dome, good thing about this place is the outdoor smoking patio with the view from the 53rd level. Very nice, but we didn't really get to enjoy it for long because it was raining and they closed it off at a certain time. The setup is pretty nice and the music was ok. It is me or do most Vegas clubs go from hip hop to rock to hip hop to electronica (house\/trance)? I go to clubs to listen to hip hop and rap and that top 40 stuff, not rock or electronica, although I don't mind them...If I wanna listen to house or trance I'll go to a rave not a club. Everyone seems to enjoy it, but when they play that rock stuff, I'll just go smoke, go to the bathroom, or grab a drink. Oh yeah, you get into Playboy club too by going here...which isn't really much. Drinks are your typical Vegas prices, an arm and a leg for almost everything.",1,1,1
p5EiB7erHmaqjGPQqPqt8g,iXrAopoO2i5w-XcexT0g5A,WtmNaLkPsJTuDoW-kieY9w,5,2016-08-30,Friendly staff unique inventive food. Me & Dad pop in for what to us turned into a memorable lunch. Thank you Super Chunk.,0,0,0
SkIb3nj4QdVfwm1uFSPfoA,LPn2OWtlRXMySdxmHJAOlw,UxZGTQVs5J6Yd_JZm4RHNQ,5,2017-02-16,I came here at 8am to get a smog check and it's just a little shack like building on the corner. The process was quick and easy & if you check in on yelp you can save a few dollars. The guy who did the smog check was super nice and told me everything he was going to do before he did it (it's nice to know what's being done to your car) and because I didn't have change and didn't carry car he was helpful enough to grab me change from the bank.,0,0,0
hbLAVl1eu8qDlPUxDHa__w,aat7AAw1PVLaM2AhHd9MAQ,r_J_EDBkDo0w1voQaKd1NA,4,2016-11-02,"I have been going to this location for a year and a half now and I just left having one of the worst haircuts I ever had. 

If you go to this location go to anyone but Lauren. I wanted a simple clean up with a 6' fade on the side, a hardline, and shorting the back. She did none of the such. 

I received a terrible clean up with the most uneven buzz on my sides, she never gave the hardline I asked for, and did nothing to my back side. Just cornered them when I wanted them rounded. 

Just terrible job. I'm currently on my way to the location on Warm Springs and Rainbow to have it corrected.

The only reason I gave this 4 stars is because everyone else at this location has done a great job and don't deserve a one star. However Lauren does.",0,1,0
1H4hs4GWLekmGQs-AsQSIA,7V29xzsIxlHfdcHsnpHB3Q,brpJ1jYGH_Pgrx7dKIqesA,5,2012-06-25,"This place is absolutely awesome.  Going here is definitely an all day experience, so plan your day around going here because it is worth it and you will have a great time.  They also have a great guitar exhibit!",1,0,0
F2PFFdjP-F7fAHNG7CJ30w,iGIJxX7VqqKM4CU18t-2Xg,mShOJ9qFk79KnZq7E8k9hQ,5,2012-07-09,"My husband had the fish and chips and he loved it.

I enjoyed the high tea.  I think it's a great price compared to what you would get in the hotels.  I like the simplicity that they have the high tea everyday rather than trying to remember which hotel does it on the weekdays or weekends... The ambiance is nice.",0,0,0
we66q-6ayOYSAbfdhp6kBQ,YwPizf03oBb_mfysOqELDA,Gaq3S9lmjXVcuDCZ8ulppw,1,2014-01-26,"This place used to be good with good service and atmosphere. Now, hands down the WORST thing about Oyshi is the SERVICE. We have given this place multiple chances thinking something would change, but it just keeps getting worse. Unless you speak the language there, they don't care about your service. It's so frustrating to be sitting there for 30min, with nothing but a drink, and seeing so many others (who even come in after you) get served their food. Never again is this place worth our time or money. Definitely DO NOT recommend Oyshi if you're looking for good food or even relatively descent service",0,0,0
kqNd1HdM8KVwHNmXeGfALw,RxeySjYAm9RY0CbSqj0N6Q,QqE0ECLim5hA-sV-kJiIIA,5,2015-08-22,"For some reason, Yelp thought that my first and last post was ""fake"" and did not merit the ""highly recommended"" list. Attention Yelp staff. My name is Stephan Galdau, my email is smg19775@gmail.com and if you have any doubts please feel free to contact me. I am a local business owner in this town, I just recently purchased a tavern with food and gambling and you took down my post because I raved about my experience and their staff? My cocktail Renee, the bucks girl Gabi, their manager Chris treated me like family, never walked in there before and because I gave them 5 stars and acknowdleged their warmth and amazing hospitality you assumed it was fake? Please fire the morons that are jeodpordizing the credibility and accuracy of your product and please feel free to contact me",0,0,1
iJaFgnVSI7rbLjygdWN1-g,twpPUb_1O9tAPveSdg22lQ,7hUp4XxmUCGqvPFAM8IJww,3,2014-08-14,"I just have a few words about this restaurant, if you take forever to serve the damn food than the food isn't superb. My spring mix salad didn't have enough sauce, it just tasted like leaves. I also had the sweet chile chicken with chipotle chips, that was pretty good but the chicken wasn't warm. For dessert I had the white chocolate brownie, that I had no complains with, it was delicious. The G.T. drink was amazing. The portions are perfect.  I hate that it takes half an hour for my salad to come. The girls are very slutty dressed. I've noticed they only choose attractive people to work there. They should consider their qualifications not their looks.",0,0,0
ojKZrEIbiGzKYPNA08fuZA,spryntfH8mG9RGVmf8CpMw,w6zW6gIyg1sI5V6Wag_SYg,5,2016-01-12,My wife decided to pick up dinner and noticed this place nestled in the fresh and easy parking lot. I myself have never experienced anything like this but from what she tells me these places are big in Japan. With that said I must say this place is really good and authentic I was speaking to the owner asking him why the steak is so tender and he replied that he uses only prime beef which explains why it is perfect every time this is a perfect example of a small business struggling to start up in America they need all the support from local foodies like us.,0,0,0
eymuAi18fADlQ4ybZY-9vg,lQohCnkRK14WFNGUPTKKgQ,qW3PBsThG4A3bXz4YnPvIw,5,2016-11-10,"Amazing service with food for a family restaurant.  You get a ton of food for what you pay for, a great deal.  I've been there a bunch and have enjoyed everything I've had off their diverse menu.  Highly recommend for good affordable food with great service.",0,0,0
3f1mWhMG34YxD7KgW2uOTA,jTD61Xp8O8RL3tiuJe7ikQ,9o8Zie2MHPwJFOkOsXbqPw,1,2014-10-24,"Today we received a call from the DM of the Uhaul location letting us know that they would not have any trucks in the state of Illinois.  The only way we would be getting a truck is to drive to get it in Lafayette, IN.  I said that was unacceptable as we have had the reservation for over a week and have a week before the reservation was to happen.  Then she said we don't require our locations to go pick up the vehicles for you and we aren't going to pay for your rental... What does she mean pay for my rental when we are paying over $300 to rent the truck in the first place.  Then they want us to travel 3 hours and pay for the gas to get the vehicle prior to us even starting our move?  Poor customer service.  I would not recommend the company and as a company would not employ people with such poor customer service and communication skills. We then called Budget, they confirmed they would have a truck or go pick up one for us, and what a difference in experience.  Uhaul needs to learn from its competitors, though this is the first bad experience with the company as we have had great service in other areas prior.  Again I think it is the management from DM, to store manager, to employee who answered the phone.",0,0,0
qwvAR7AJXtCT2nhYqDpyew,jq4u6Z-4GZ5ZynhJa7dAyA,nSs3g05G4adAmM8YFvvSjQ,1,2010-01-21,"Waren vor einiger Zeit mit einigen Freunden auf eine Empfehlung hin im GOI. 
Anschlieend wollten wir ins Kino gehen und den Abend genieen.


 Die Preise sind normal, die Portionen jedoch sind einfach riesig. 
Bestellt war schnell.. und die Essen waren auch zgig an unserem Tisch. Whrend des essens hatte ich pltzlich ein komisches Gefhl im Magen, dachte mir jedoch nix dabei. Nachdem ich die hlfte meines Tellers gegessen hatte MUSSTE ich auf die Toilette diese waren recht sauber und sehr gro.


 Auf dieser Toilette verbrachte ich dann geschtzte 25 Minuten.. und blockierte das WC.
Anderen in unserer Gruppe ging es hnlich.
Ich will gar nicht wissen wie viel Glutamat in dem Essen war!?


 Den Kinobesuch hat dass Essen im Goi leider auch zu einem unertrglichen Ereignis gemacht an dass ich mich noch lange erinnern werde.


 GOI -- Nicht noch einmal.",0,0,0
jsZ9quX_pvBny_IaoOsF-Q,5V8eXkTJb6IejJkMDaj_Bw,J0rx5BsejdRTXU8UB-MJSA,2,2011-04-27,"I can't believe I've been to this place twice, but when I'm at the Arizona Center for an event, I'm short on time, and I'm hungry, this is actually the best place to get a quick bite.

It's your average takeout pizza\/pasta joint, like a mom and pop Sbarro. I've only ever had pizza here as the pasta isn't a quick deal. The sad part is that the last time I was there especially, I didn't even remember eating there shortly after, because I was still hungry. Not very filling.

Also, just a note that if you plan on just grabbing a beer here, and want to pay with a card, there's a $5 min for card transaction. In that situation, either pay with cash, or grab some sun chips, which put it at the minimum level.",3,0,0
